id,Label,TF,KEGG,kTotal,Rank,WGCNA_Modules, IntraModular Connectivity,Description,GO
87,Os03g0356414,,Ubiquitin mediated proteolysis,204.142200821392,93,Turquoise,167.545966309543,Similar to Ubiquitin ligase SINAT5 (EC 6.3.2.-) (Seven in absentia homolog 5). Splice isoform 2.,"Biological Process: ubiquitin-dependent protein catabolic process (GO:0006511), Biological Process: multicellular organismal development (GO:0007275), Biological Process: protein ubiquitination (GO:0016567), Cellular Component: nucleus (GO:0005634), Molecular Function: ubiquitin-protein ligase activity (GO:0004842), Molecular Function: protein binding (GO:0005515), Molecular Function: zinc ion binding (GO:0008270)"
88,Os06g0693700,,,179.578059587919,237,Turquoise,167.27278440058,"Protein of unknown function DUF1644 family protein., Similar to predicted protein.","Cellular Component: intracellular (GO:0005622), Molecular Function: zinc ion binding (GO:0008270)"
89,Os01g0862600,,,177.881319651067,249,Turquoise,167.053401468278,Protein of unknown function DUF584 family protein.,
90,Os06g0681200,,,180.890808285993,229,Turquoise,166.980087488731,Cupredoxin domain containing protein.,"Molecular Function: copper ion binding (GO:0005507), Molecular Function: electron carrier activity (GO:0009055)"
91,Os02g0254700,,,184.359603898554,215,Turquoise,166.482596147601,Similar to Spermidine synthase 3.,Molecular Function: catalytic activity (GO:0003824)
92,Os06g0145600,,,184.312537937688,216,Turquoise,165.998265751273,Transferase family protein.,"Molecular Function: transferase activity, transferring acyl groups other than amino-acyl groups (GO:0016747)"
93,Os02g0736400,,"Pyrimidine metabolism, beta-Alanine metabolism, Pantothenate and CoA biosynthesis, Metabolic pathways",190.594371294411,174,Turquoise,164.904656308704,Aldolase-type TIM barrel domain containing protein.,"Biological Process: 'de novo' pyrimidine base biosynthetic process (GO:0006207), Biological Process: UMP biosynthetic process (GO:0006222), Biological Process: metabolic process (GO:0008152), Biological Process: oxidation-reduction process (GO:0055114), Cellular Component: cytoplasm (GO:0005737), Molecular Function: catalytic activity (GO:0003824), Molecular Function: dihydroorotate dehydrogenase activity (GO:0004152), Molecular Function: dihydroorotate oxidase activity (GO:0004158)"
94,Os09g0109600,,,180.820548776289,230,Turquoise,164.554061281944,"Small peptide, Drought tolerance",
95,Os01g0270100,,,178.749829306179,242,Turquoise,164.18161382448,"Similar to Cysteine protease inhibitor., Similar to cDNA clone:001-200-C04, full insert sequence.",Molecular Function: cysteine-type endopeptidase inhibitor activity (GO:0004869)
96,Os10g0505900,,,186.558709671687,197,Turquoise,164.14077040361,Conserved hypothetical protein.,
97,Os06g0714000,,,173.755998604671,271,Turquoise,164.018028994757,Uncharacterised protein family UPF0183 domain containing protein.,
98,Os03g0644000,,Autophagy - other,185.260801040145,205,Turquoise,163.905859048331,"ATG6/Beclin-1 protein, Abiotic stresses (heat, cold and drought) and hormone (abscisic acid) response",Biological Process: autophagy (GO:0006914)
99,Os12g0568800,,RNA transport,173.239905752372,279,Turquoise,163.30738467291,"Similar to predicted protein., Non-protein coding transcript.","Molecular Function: binding (GO:0005488),"
