id,Label,TF,KEGG,kTotal,Rank,WGCNA_Modules, IntraModular Connectivity,Description,GO
90,Os03g0841700,,,12.8634456470334,5292,Pink,9.20652026740408,Similar to Prohibitin.,
91,Os06g0105400,,"Glycolysis / Gluconeogenesis, Citrate cycle (TCA cycle), Pyruvate metabolism, Metabolic pathways, Biosynthesis of secondary metabolites, Carbon metabolism",14.3914481769579,4789,Pink,9.19492577101897,"Similar to dihydrolipoamide S-acetyltransferase., Similar to Dihydrolipoamide S-acetyltransferase (EC 2.3.1.12).","Biological Process: metabolic process (GO:0008152), Molecular Function: transferase activity, transferring acyl groups (GO:0016746), Biological Process: pyruvate metabolic process (GO:0006090), Biological Process: metabolic process (GO:0008152), Cellular Component: pyruvate dehydrogenase complex (GO:0045254), Molecular Function: dihydrolipoyllysine-residue acetyltransferase activity (GO:0004742), Molecular Function: transferase activity, transferring acyl groups (GO:0016746)"
92,Os01g0609300,,,33.1452667272096,1708,Pink,9.19422716550399,"Similar to Pleiotropic drug resistance protein 3., Hypothetical conserved gene.","Cellular Component: membrane (GO:0016020), Molecular Function: nucleotide binding (GO:0000166), Molecular Function: ATP binding (GO:0005524), Molecular Function: ATPase activity (GO:0016887), Molecular Function: nucleoside-triphosphatase activity (GO:0017111), Cellular Component: membrane (GO:0016020)"
93,Os09g0520200,,,27.7640882087939,2240,Pink,9.19157932696448,Similar to abhydrolase domain-containing protein 5.,Molecular Function: catalytic activity (GO:0003824)
94,Os03g0269000,,"Tropane, piperidine and pyridine alkaloid biosynthesis, Metabolic pathways, Biosynthesis of secondary metabolites",12.7545073808952,5330,Pink,9.17722586085032,Short chain alcohol dehydrogenase-like.,"Biological Process: metabolic process (GO:0008152), Molecular Function: nucleotide binding (GO:0000166), Molecular Function: oxidoreductase activity (GO:0016491)"
95,Os03g0838800,C2H2,,26.8450706347189,2345,Pink,9.15158899973076,"Zinc finger, C2H2 domain containing protein.","Cellular Component: intracellular (GO:0005622), Molecular Function: nucleic acid binding (GO:0003676), Molecular Function: zinc ion binding (GO:0008270)"
96,Os08g0428100,,,34.8689732938423,1591,Pink,9.09654753952352,Hypothetical conserved gene.,
97,Os07g0684000,,,22.4592494947063,2976,Pink,9.08366341140574,Ricin B-related lectin domain containing protein.,
98,Os10g0525500,,Glutathione metabolism,11.0318067897835,5923,Pink,9.08083002185686,Similar to glutathione transferase31.,Molecular Function: protein binding (GO:0005515)
99,Os05g0157200,,,20.2811182953964,3350,Pink,9.05103654134729,UspA domain containing protein.,Biological Process: response to stress (GO:0006950)
