id,Label,Description,GO,Symbol,KEGG,MapMan,MSU_LOC,TF,kTotal,Rank,WGCNA_Modules,IntraModular Connectivity
0,Os08g0174800,Similar to Benzothiadiazole-induced somatic embryogenesis receptor kinase 1.,"Biological Process: defense response (GO:0006952), Molecular Function: transferase activity, transferring phosphorus-containing groups (GO:0016772), Molecular Function: ADP binding (GO:0043531), Molecular Function: transferase activity, transferring phosphorus-containing groups (GO:0016772)",,,['signalling.receptor kinases.leucine rich repeat II'],LOC_Os08g07774,,85.971782032539,1839,Black,31.671519002899
1,Os06g0287700,"Similar to NBS-LRR disease resistance protein homologue (Fragment)., Non-protein coding transcript., Similar to Nbs-lrr disease resistance protein (Fragment).","Biological Process: defense response (GO:0006952), Molecular Function: ADP binding (GO:0043531),",,,['stress.biotic'],LOC_Os06g17970,,127.884409863945,834,Black,30.7324201027067
2,Os09g0355400,"Protein kinase, core domain containing protein., Similar to OsD305.","Biological Process: protein phosphorylation (GO:0006468), Molecular Function: protein kinase activity (GO:0004672), Molecular Function: protein serine/threonine kinase activity (GO:0004674), Molecular Function: protein binding (GO:0005515), Molecular Function: ATP binding (GO:0005524), Molecular Function: transferase activity, transferring phosphorus-containing groups (GO:0016772), Biological Process: protein phosphorylation (GO:0006468), Molecular Function: protein kinase activity (GO:0004672), Molecular Function: protein serine/threonine kinase activity (GO:0004674), Molecular Function: protein tyrosine kinase activity (GO:0004713), Molecular Function: ATP binding (GO:0005524), Molecular Function: transferase activity, transferring phosphorus-containing groups (GO:0016772)",,,['signalling.receptor kinases.misc'],LOC_Os09g18594,,50.2440941695732,3371,Black,30.0665927856948
3,Os03g0206700,BTB/POZ fold domain containing protein.,"Biological Process: response to light stimulus (GO:0009416), Molecular Function: signal transducer activity (GO:0004871), Molecular Function: protein binding (GO:0005515)",,,['signalling.light'],LOC_Os03g10880,,90.0221719339471,1705,Black,29.6273275930255
4,Os02g0281000,"RmlC-like jelly roll fold domain containing protein., Similar to predicted protein.","Biological Process: regulation of protein phosphorylation (GO:0001932), Biological Process: protein phosphorylation (GO:0006468), Biological Process: protein dephosphorylation (GO:0006470), Cellular Component: cAMP-dependent protein kinase complex (GO:0005952), Cellular Component: protein serine/threonine phosphatase complex (GO:0008287), Molecular Function: catalytic activity (GO:0003824), Molecular Function: protein kinase activity (GO:0004672), Molecular Function: protein serine/threonine kinase activity (GO:0004674), Molecular Function: protein serine/threonine phosphatase activity (GO:0004722), Molecular Function: ATP binding (GO:0005524), Molecular Function: cAMP-dependent protein kinase regulator activity (GO:0008603), Molecular Function: transferase activity, transferring phosphorus-containing groups (GO:0016772), Molecular Function: catalytic activity (GO:0003824)",OsPKG,,['protein.postranslational modification'],LOC_Os02g17970,,64.2824253168992,2659,Black,28.6846671979375
5,Os07g0650600,"Similar to BLE2 protein., Hypothetical conserved gene., BLE2 protein.","Molecular Function: binding (GO:0005488),",OsBLE2,,['not assigned.unknown'],LOC_Os07g45570,,49.0555556859312,3455,Black,28.1916768637198
6,Os01g0664000,Similar to carboxyl-terminal-processing protease.,"Biological Process: proteolysis (GO:0006508), Molecular Function: protein binding (GO:0005515), Molecular Function: serine-type peptidase activity (GO:0008236)",,,['protein.degradation'],LOC_Os01g47450,,94.3886919728313,1584,Black,27.9604058412295
7,Os06g0483500,Similar to H0124B04.15 protein.,,,,['not assigned.unknown'],LOC_Os06g28840,,115.518300702807,1062,Black,27.4576796352599
8,Os02g0727300,"Similar to Beta-catenin repeat family protein., Similar to ubiquitin-protein ligase.","Biological Process: protein ubiquitination (GO:0016567), Cellular Component: ubiquitin ligase complex (GO:0000151), Molecular Function: ubiquitin-protein ligase activity (GO:0004842), Molecular Function: binding (GO:0005488), Molecular Function: protein binding (GO:0005515), Molecular Function: binding (GO:0005488), Molecular Function: protein binding (GO:0005515)",OsPUB21,,['protein.degradation.ubiquitin.E3.RING'],LOC_Os02g49520,,58.7534834552242,2920,Black,27.2785582042388
9,Os01g0841800,Ribonuclease II and R domain containing protein.,"Molecular Function: RNA binding (GO:0003723), Molecular Function: ribonuclease activity (GO:0004540)",,,['RNA.processing.ribonucleases'],LOC_Os01g62440,,96.9033944734076,1511,Black,27.1145622381453
10,Os02g0672200,"Similar to AGO1 homologous protein., Similar to Protein argonaute 1A.","Molecular Function: nucleic acid binding (GO:0003676), Molecular Function: protein binding (GO:0005515)",OsAGO1a,,['development.unspecified'],LOC_Os02g45070,,52.6232033332001,3234,Black,26.604068722809
11,Os02g0255801,Non-protein coding transcript.,,,,,None,,107.143926928227,1235,Black,26.4614016895381
12,Os02g0477100,Hypothetical conserved gene.,,,,['not assigned.unknown'],LOC_Os02g27592,,79.8950634078051,2050,Black,26.3230166487625
13,Os01g0960300,"Similar to Glucose inhibited division protein A., Similar to Glucose-inhibited division A family protein.","Biological Process: tRNA wobble uridine modification (GO:0002098), Biological Process: tRNA processing (GO:0008033), Molecular Function: flavin adenine dinucleotide binding (GO:0050660)",,,['signalling.in sugar and nutrient physiology'],LOC_Os01g72980,,62.506216128068,2730,Black,26.1633766800131
14,Os01g0142100,"Peptidase M50 family protein., Similar to Metalloendopeptidase.","Biological Process: proteolysis (GO:0006508), Molecular Function: metalloendopeptidase activity (GO:0004222)",,,['protein.degradation'],LOC_Os01g04900,,122.026653368318,930,Black,25.9645862363364
15,Os08g0355400,"Protein of unknown function DUF247, plant family protein., Hypothetical conserved gene.",,,,['not assigned.unknown'],LOC_Os08g26710,,45.0274896288967,3709,Black,25.1898649852797
16,Os02g0729300,"Zinc finger, CCHC retroviral-type domain containing protein.","Molecular Function: nucleic acid binding (GO:0003676), Molecular Function: zinc ion binding (GO:0008270)",,,['not assigned.unknown'],LOC_Os02g49670,,42.3953767826735,3902,Black,24.9526338883507
17,Os01g0619900,Similar to DNA binding.,,,,['not assigned.unknown'],LOC_Os01g43230,MYB_related,51.9206034156636,3271,Black,24.8383862875286
18,Os07g0287100,Conserved hypothetical protein.,,,,['not assigned.unknown'],LOC_Os07g18720,,69.9334614293031,2423,Black,24.6578059549872
19,Os01g0271400,"Peptidase S14, ClpP family protein.","Biological Process: proteolysis (GO:0006508), Molecular Function: serine-type endopeptidase activity (GO:0004252)",CLPR4,,['protein.degradation.serine protease'],LOC_Os01g16530,,91.9883618588854,1646,Black,23.8015878217753
20,Os03g0795200,Pentatricopeptide repeat domain containing protein.,,,,"['RNA.regulation of transcription.MYB domain transcription factor family', 'transport.misc']",LOC_Os03g58100,,72.963670212267,2306,Black,23.7042845515034
21,Os02g0518400,Hypothetical protein.,,,,,None,,50.990438966168,3327,Black,23.6582981465153
22,Os12g0151500,"Similar to Alpha-2, 8-sialyltransferase 8B (EC 2.4.99.-) (ST8Sia II) (Sialyltransferase X) (STX).","Biological Process: protein glycosylation (GO:0006486), Cellular Component: integral to Golgi membrane (GO:0030173), Molecular Function: sialyltransferase activity (GO:0008373)",,,['protein.glycosylation'],LOC_Os12g05550,,118.002095490053,1000,Black,23.5023257359862
23,Os02g0522300,"Conserved hypothetical protein., Similar to cDNA clone:001-036-H04, full insert sequence.",,,,['not assigned.unknown'],LOC_Os02g32250,,47.2699881695074,3570,Black,23.2323272302952
24,Os09g0444200,"Lecithin:cholesterol acyltransferase family protein., Similar to predicted protein.","Biological Process: lipid metabolic process (GO:0006629), Molecular Function: O-acyltransferase activity (GO:0008374)",,"Glycerolipid metabolism, Metabolic pathways","[""lipid metabolism.'exotics' (steroids, squalene etc).phosphatidylcholinesterol O-acyltransferase""]",LOC_Os09g27210,,90.2678303220559,1698,Black,23.0971087424153
25,Os02g0184300,Hypothetical protein.,,,,,None,,71.2698150330591,2366,Black,22.9545206905806
26,Os02g0602400,"Mitochodrial transcription termination factor-related family protein., Hypothetical conserved gene.",,,,['RNA.regulation of transcription.unclassified'],LOC_Os02g39040,,52.396118463226,3247,Black,22.5423653587709
27,Os03g0823200,Similar to predicted protein.,"Biological Process: transmembrane transport (GO:0055085), Cellular Component: integral to membrane (GO:0016021), Molecular Function: transmembrane transporter activity (GO:0022857)",,,,LOC_Os03g60820,,39.1702895869743,4188,Black,22.2313759676022
28,Os11g0163100,Similar to Actin 7 (Actin 2).,Molecular Function: ATP binding (GO:0005524),OsACTIN2,,['cell.organisation'],LOC_Os11g06390,,52.100184872863,3260,Black,22.1850215259093
29,Os12g0171500,Conserved hypothetical protein.,,,,,None,,72.5659943336375,2321,Black,22.0814038523934
30,Os06g0151900,Phosphofructokinase family protein.,"Biological Process: glycolysis (GO:0006096), Cellular Component: 6-phosphofructokinase complex (GO:0005945), Molecular Function: 6-phosphofructokinase activity (GO:0003872)",,,['glycolysis.plastid branch.phosphofructokinase (PFK)'],LOC_Os06g05860,,69.898426597188,2425,Black,22.0328249991497
31,Os05g0164100,"Similar to Fructose-6-phosphate 2-kinase/fructose-2, 6-bisphosphatase (EC 2.7.1.105) (EC 3.1.3.46) (Fragment)., Similar to Fructose-6-phosphate-2-kinase/fructose-2, 6-bisphosphatase.","Biological Process: carbohydrate metabolic process (GO:0005975), Biological Process: fructose metabolic process (GO:0006000), Biological Process: fructose 2, 6-bisphosphate metabolic process (GO:0006003), Biological Process: metabolic process (GO:0008152), Molecular Function: catalytic activity (GO:0003824), Molecular Function: 6-phosphofructo-2-kinase activity (GO:0003873), Molecular Function: fructose-2, 6-bisphosphate 2-phosphatase activity (GO:0004331), Molecular Function: ATP binding (GO:0005524), Molecular Function: carbohydrate binding (GO:0030246), Biological Process: fructose metabolic process (GO:0006000), Biological Process: fructose 2, 6-bisphosphate metabolic process (GO:0006003), Biological Process: metabolic process (GO:0008152), Molecular Function: catalytic activity (GO:0003824), Molecular Function: 6-phosphofructo-2-kinase activity (GO:0003873), Molecular Function: fructose-2, 6-bisphosphate 2-phosphatase activity (GO:0004331), Molecular Function: ATP binding (GO:0005524)",,"Fructose and mannose metabolism, Metabolic pathways","['glycolysis.cytosolic branch.fructose-2,6-bisphosphatase (Fru2,6BisPase)']",LOC_Os05g07130,,101.256581366596,1385,Black,21.8836203763936
32,Os05g0586900,Hypothetical conserved gene.,Molecular Function: binding (GO:0005488),,,"['RNA.regulation of transcription.MYB domain transcription factor family', 'transport.misc']",LOC_Os05g50950,,67.327650383045,2530,Black,21.205486398022
33,Os04g0607400,Conserved hypothetical protein.,,,,['not assigned.unknown'],LOC_Os04g51809,,49.640133462549,3413,Black,21.1945355038664
34,Os05g0365300,"Nucleotide-binding site leucine-rich repeat (NBS-LRR) protein, Bacterial blight resistance, Similar to NBS-LRR-like protein (Fragment).",Molecular Function: ADP binding (GO:0043531),"OsBBR1, OsRP1L1, rNBS33",,['stress.biotic.PR-proteins'],LOC_Os05g30220,,110.412335262068,1163,Black,21.1333582375614
35,Os02g0225000,"Similar to cDNA clone:001-044-E12, full insert sequence.",,,Peroxisome,['transport.metabolite transporters at the mitochondrial membrane'],LOC_Os02g13170,,56.1652739381644,3045,Black,20.9899820764027
36,Os01g0309800,Similar to Hydrogenase expression/formation protein hypB.,"Biological Process: metal ion transport (GO:0030001), Molecular Function: metal ion binding (GO:0046872)",,,['transport.metal'],LOC_Os01g20830,,38.9151288640803,4211,Black,20.8878763523651
37,Os11g0580800,Twin-arginine translocation protein TatB family protein.,"Biological Process: protein secretion (GO:0009306), Biological Process: protein transport (GO:0015031), Cellular Component: plasma membrane (GO:0005886), Cellular Component: membrane (GO:0016020), Cellular Component: integral to membrane (GO:0016021), Molecular Function: protein transporter activity (GO:0008565)",,,['protein.targeting.chloroplast'],LOC_Os11g37130,,49.0802316116085,3451,Black,20.8464799941699
38,Os06g0707400,"Conserved hypothetical protein., Similar to NBS-LRR disease resistance protein homologue.",,,,['stress.biotic.PR-proteins'],LOC_Os06g49360,,48.444207356111,3486,Black,20.7079449549816
39,Os06g0111300,Hypothetical conserved gene.,Molecular Function: binding (GO:0005488),,,['development.unspecified'],LOC_Os06g02120,,68.5431772424865,2482,Black,20.6380017642633
40,Os06g0606800,"Targeting for Xklp2 family protein., Similar to WDL1.",,,,['not assigned.unknown'],LOC_Os06g40450,,36.5679714080556,4415,Black,20.3655956756746
41,Os04g0684500,"Pentatricopeptide repeat protein, Chloroplast development under cold stress, Hypothetical conserved gene.","Molecular Function: nucleic acid binding (GO:0003676), Molecular Function: protein binding (GO:0005515), Molecular Function: nucleotide binding (GO:0000166), Molecular Function: nucleic acid binding (GO:0003676), Molecular Function: binding (GO:0005488)",WSL5,,['development.unspecified'],LOC_Os04g58780,,89.6853379521144,1715,Black,20.1864459615727
42,Os06g0218500,"MCM family protein., Non-protein coding transcript.","Biological Process: DNA replication (GO:0006260), Molecular Function: nucleotide binding (GO:0000166), Molecular Function: DNA binding (GO:0003677), Molecular Function: ATP binding (GO:0005524), Molecular Function: nucleoside-triphosphatase activity (GO:0017111),","OsMCM2, OsMCM9",,['DNA.synthesis/chromatin structure'],LOC_Os06g11500,,77.8771154342534,2122,Black,20.1744003072531
43,Os03g0109900,"Peptidase, trypsin-like serine and cysteine domain containing protein., Hypothetical conserved gene., Peptidase cysteine/serine, trypsin-like domain containing protein.",Molecular Function: catalytic activity (GO:0003824),,,['not assigned.unknown'],LOC_Os03g01940,,38.1149559451926,4282,Black,20.054084520933
44,Os03g0823100,Major facilitator superfamily protein.,"Biological Process: transmembrane transport (GO:0055085), Cellular Component: membrane (GO:0016020), Cellular Component: integral to membrane (GO:0016021), Molecular Function: transmembrane transporter activity (GO:0022857), Molecular Function: substrate-specific transmembrane transporter activity (GO:0022891)",OsXTPH1,,,LOC_Os03g60820,,63.3145966596763,2698,Black,20.0376332658362
45,Os03g0848100,"Similar to Ser/Thr protein phosphatase family protein, expressed.",,,,['not assigned.unknown'],LOC_Os03g63074,,47.6833416944775,3536,Black,19.8778440660075
46,Os03g0732200,Similar to dynamin-2A.,,,,['misc.dynamin'],LOC_Os03g52230,,99.5362366099878,1433,Black,19.8399008242181
47,Os06g0202400,Conserved hypothetical protein.,,,,,None,,37.1620692580195,4363,Black,19.8230789734214
48,Os04g0544100,Similar to SET domain-containing protein SET104.,"Biological Process: histone lysine methylation (GO:0034968), Cellular Component: nucleus (GO:0005634), Molecular Function: protein binding (GO:0005515), Molecular Function: zinc ion binding (GO:0008270), Molecular Function: histone-lysine N-methyltransferase activity (GO:0018024), Molecular Function: histone binding (GO:0042393)",OsSET20|SDG703|OsSUVH5,,['RNA.regulation of transcription.SET-domain transcriptional regulator family'],LOC_Os04g45990,,70.194281262839,2415,Black,19.7725592609387
49,Os12g0226400,Similar to 2-alkenal reductase.,"Biological Process: oxidation-reduction process (GO:0055114), Molecular Function: nucleotide binding (GO:0000166), Molecular Function: zinc ion binding (GO:0008270), Molecular Function: oxidoreductase activity (GO:0016491), Molecular Function: transferase activity, transferring acyl groups other than amino-acyl groups (GO:0016747)",,,"['misc.oxidases - copper, flavone etc.']",LOC_Os12g12514,,42.7557318100964,3882,Black,19.5750896960727
50,Os06g0202300,Conserved hypothetical protein.,,,,['not assigned.unknown'],LOC_Os06g10109,,45.3498995417786,3680,Black,19.5738529461869
51,Os11g0195100,Similar to Protein translocase subunit secA.,"Biological Process: protein targeting (GO:0006605), Biological Process: intracellular protein transport (GO:0006886), Biological Process: protein import (GO:0017038), Cellular Component: membrane (GO:0016020), Molecular Function: ATP binding (GO:0005524)",,Protein export,['protein.targeting.chloroplast'],LOC_Os11g08980,,41.9991323393651,3924,Black,19.4905327643635
52,Os07g0679700,Transcriptional factor B3 family protein.,"Biological Process: regulation of transcription, DNA-dependent (GO:0006355), Molecular Function: DNA binding (GO:0003677), Molecular Function: zinc ion binding (GO:0008270)",OsVAL2,,['RNA.regulation of transcription.ABI3/VP1-related B3-domain-containing transcription factor family'],LOC_Os07g48200,B3,46.714559479473,3603,Black,19.3360693373642
53,Os02g0326700,"Peptidase S54, rhomboid domain containing protein.","Biological Process: proteolysis (GO:0006508), Cellular Component: integral to membrane (GO:0016021), Molecular Function: serine-type endopeptidase activity (GO:0004252)",,,['protein.degradation.serine protease'],LOC_Os02g22100,,82.9881360541562,1940,Black,19.264226635294
54,Os03g0835100,Similar to Chloroplast protein import component Toc159.,"Molecular Function: GTP binding (GO:0005525), Molecular Function: hydrolase activity, acting on acid anhydrides (GO:0016817)",,,['protein.targeting.chloroplast'],LOC_Os03g61890,,80.1483234959907,2042,Black,19.2325242098631
55,Os09g0367900,"Conserved hypothetical protein., Hypothetical conserved gene.",,OsaFLZ27,,['not assigned.unknown'],LOC_Os09g20240,,57.6844650852091,2975,Black,19.0308103934446
56,Os06g0655100,Similar to D-3-phosphoglycerate dehydrogenase.,"Biological Process: L-serine biosynthetic process (GO:0006564), Biological Process: metabolic process (GO:0008152), Biological Process: oxidation-reduction process (GO:0055114), Molecular Function: nucleotide binding (GO:0000166), Molecular Function: phosphoglycerate dehydrogenase activity (GO:0004617), Molecular Function: amino acid binding (GO:0016597), Molecular Function: oxidoreductase activity, acting on the CH-OH group of donors, NAD or NADP as acceptor (GO:0016616), Molecular Function: cofactor binding (GO:0048037), Molecular Function: NAD binding (GO:0051287)",,"Glycine, serine and threonine metabolism, Cysteine and methionine metabolism, Metabolic pathways, Biosynthesis of secondary metabolites, Carbon metabolism, Biosynthesis of amino acids",['amino acid metabolism.synthesis.serine-glycine-cysteine group.serine.phosphoglycerate dehydrogenase'],LOC_Os06g44460,,48.3851180352897,3490,Black,18.9876707421519
57,Os02g0132500,Similar to Common plant regulatory factor 7.,"Biological Process: regulation of transcription, DNA-dependent (GO:0006355), Molecular Function: sequence-specific DNA binding transcription factor activity (GO:0003700), Molecular Function: sequence-specific DNA binding (GO:0043565), Molecular Function: protein dimerization activity (GO:0046983)",OsbZIP14,,['RNA.regulation of transcription.bZIP transcription factor family'],LOC_Os02g03960,bZIP,31.7820088237755,4917,Black,18.8921065031816
58,Os08g0202300,"Hypothetical conserved gene., Conserved hypothetical protein., Reverse transcriptase domain containing protein., Similar to SHR5-receptor-like kinase (Fragment).",", Biological Process: RNA-dependent DNA replication (GO:0006278), Molecular Function: RNA binding (GO:0003723), Molecular Function: RNA-directed DNA polymerase activity (GO:0003964), Molecular Function: protein binding (GO:0005515)",,,['RNA.transcription'],"LOC_Os08g10244, LOC_Os08g10250",,33.7552902512994,4693,Black,18.8888517000457
59,Os01g0674700,Similar to EMB2279 (EMBRYO DEFECTIVE 2279).,Molecular Function: binding (GO:0005488),ASL3,,['development.unspecified'],LOC_Os01g48380,,50.5674692604317,3352,Black,18.8510978517544
60,Os12g0103000,EF-Hand type domain containing protein.,"Biological Process: transport (GO:0006810), Biological Process: transmembrane transport (GO:0055085), Cellular Component: mitochondrial inner membrane (GO:0005743), Molecular Function: binding (GO:0005488), Molecular Function: calcium ion binding (GO:0005509)",,,['transport.metabolite transporters at the mitochondrial membrane'],LOC_Os12g01240,,74.4025958627139,2250,Black,18.6853577686247
61,Os08g0215200,Conserved hypothetical protein.,,,,['not assigned.unknown'],LOC_Os08g11470,,39.3216951146024,4174,Black,18.5681486560577
62,Os01g0872800,"Similar to 3-phosphoinositide-dependent protein kinase-1 (Fragment)., Similar to 3-phosphoinositide dependent protein kinase 1.","Biological Process: protein phosphorylation (GO:0006468), Molecular Function: protein kinase activity (GO:0004672), Molecular Function: protein serine/threonine kinase activity (GO:0004674), Molecular Function: protein binding (GO:0005515), Molecular Function: ATP binding (GO:0005524), Molecular Function: transferase activity, transferring phosphorus-containing groups (GO:0016772), Biological Process: protein phosphorylation (GO:0006468), Molecular Function: protein kinase activity (GO:0004672), Molecular Function: protein serine/threonine kinase activity (GO:0004674), Molecular Function: protein tyrosine kinase activity (GO:0004713), Molecular Function: protein binding (GO:0005515), Molecular Function: ATP binding (GO:0005524), Molecular Function: transferase activity, transferring phosphorus-containing groups (GO:0016772)",OsPdk1,,['protein.postranslational modification'],LOC_Os01g65230,,45.8447928980273,3650,Black,18.4551309770633
63,Os07g0102100,"Similar to Potassium transporter 22., Similar to Potassium transporter 1 (OsHAK1). Splice isoform 2.","Biological Process: potassium ion transmembrane transport (GO:0071805), Cellular Component: membrane (GO:0016020), Molecular Function: potassium ion transmembrane transporter activity (GO:0015079)",HAK22,,['transport.potassium'],LOC_Os07g01214,,111.83912763735,1137,Black,18.4507896529961
64,Os10g0507000,Conserved hypothetical protein.,,OsRPP13,,['stress.biotic.PR-proteins'],LOC_Os10g36270,,43.475800379894,3832,Black,18.3245541061889
65,Os02g0128200,Similar to Transcription factor HBP-1a (Histone-specific transcription factor HBP1).,"Biological Process: transcription, DNA-dependent (GO:0006351), Biological Process: regulation of transcription, DNA-dependent (GO:0006355), Cellular Component: nucleus (GO:0005634), Molecular Function: DNA binding (GO:0003677), Molecular Function: sequence-specific DNA binding transcription factor activity (GO:0003700), Molecular Function: sequence-specific DNA binding (GO:0043565), Molecular Function: protein dimerization activity (GO:0046983)",OsbZIP13,,['RNA.regulation of transcription.bZIP transcription factor family'],LOC_Os02g03580,bZIP,71.7068940344392,2354,Black,18.2441761047117
66,Os03g0267600,Protein of unknown function DUF3527 domain containing protein.,,,,['not assigned.unknown'],LOC_Os03g16070,,105.830456783882,1271,Black,18.1844442888229
67,Os04g0565400,"cis-Zeatin-O-glucosyltransferase, Catalyze O-glucosylation of cZ and cZ-riboside","Biological Process: metabolic process (GO:0008152), Molecular Function: transferase activity, transferring hexosyl groups (GO:0016758)","CZOGT3, OscZOGT3, cZOGT3","Zeatin biosynthesis, Biosynthesis of secondary metabolites",['misc.UDP glucosyl and glucoronyl transferases'],LOC_Os04g47770,,30.3472960739458,5067,Black,18.1500935886746
68,Os07g0165000,Similar to Prolyl-tRNA synthetase.,"Biological Process: tRNA aminoacylation for protein translation (GO:0006418), Biological Process: prolyl-tRNA aminoacylation (GO:0006433), Cellular Component: cytoplasm (GO:0005737), Molecular Function: nucleotide binding (GO:0000166), Molecular Function: aminoacyl-tRNA ligase activity (GO:0004812), Molecular Function: proline-tRNA ligase activity (GO:0004827), Molecular Function: ATP binding (GO:0005524)",,Aminoacyl-tRNA biosynthesis,['protein.aa activation.bifunctional aminoacyl-tRNA synthetase'],LOC_Os07g07060,,92.7390053507033,1624,Black,17.963574455674
69,Os12g0583500,"BTB domain containing protein., Conserved hypothetical protein.","Biological Process: response to light stimulus (GO:0009416), Molecular Function: signal transducer activity (GO:0004871), Molecular Function: protein binding (GO:0005515),",,,['signalling.light'],LOC_Os12g39380,,38.4312764297792,4256,Black,17.3437973685569
70,Os03g0805500,Similar to AAE18 (ACYL-ACTIVATING ENZYME 18); catalytic/ ligase.,,,,['lipid metabolism.FA synthesis and FA elongation.acyl coa ligase'],LOC_Os03g59080,,43.0272922138446,3859,Black,17.3015036465389
71,Os01g0874800,"Similar to DNA polymerase I., ""5-3 exonuclease domain containing protein.""","""Molecular Function: DNA binding (GO:0003677), Molecular Function: catalytic activity (GO:0003824), Molecular Function: 5-3 exonuclease activity (GO:0008409)\n""",,,['DNA.synthesis/chromatin structure'],LOC_Os01g65400,,40.3436959912415,4083,Black,17.2809897496702
