id,Label,Description,GO,Symbol,KEGG,MapMan,MSU_LOC,TF,kTotal,Rank,WGCNA_Modules,IntraModular Connectivity
72,Os11g0438000,"Hypothetical conserved gene., Similar to Short chain alcohol dehydrogenase-like.",", Biological Process: metabolic process (GO:0008152), Molecular Function: nucleotide binding (GO:0000166), Molecular Function: oxidoreductase activity (GO:0016491)",,,"['misc.nitrilases, *nitrile lyases, berberine bridge enzymes, reticuline oxidases, troponine reductases']","LOC_Os11g25090, LOC_Os11g25100",,78.7810385756519,2093,Black,17.2179747902656
73,Os08g0242800,Similar to Sigma factor SIG6.,"Biological Process: transcription initiation, DNA-dependent (GO:0006352), Biological Process: regulation of transcription, DNA-dependent (GO:0006355), Molecular Function: DNA binding (GO:0003677), Molecular Function: sequence-specific DNA binding transcription factor activity (GO:0003700), Molecular Function: sigma factor activity (GO:0016987)",OsSIG6,,,LOC_Os08g14450,,93.2420926022191,1604,Black,17.0237277646234
74,Os02g0644700,Similar to Acyl-ACP thioesterase (Fragment).,"Biological Process: fatty acid biosynthetic process (GO:0006633), Molecular Function: thiolester hydrolase activity (GO:0016790)",,"Fatty acid biosynthesis, Metabolic pathways, Fatty acid metabolism",['lipid metabolism.FA synthesis and FA elongation.ACP thioesterase'],LOC_Os02g43090,,37.9853254888409,4293,Black,17.0181033064305
75,Os09g0487700,"Ovarian tumour, otubain domain containing protein.",,,,['protein.degradation.cysteine protease'],LOC_Os09g31280,,37.8615655870672,4303,Black,16.9622208393201
76,Os10g0113900,"Similar to NAD(P)H-dependent oxidoreductase., Similar to NADPH-dependent codeinone reductase (EC 1.1.1.247).","Biological Process: oxidation-reduction process (GO:0055114), Molecular Function: oxidoreductase activity (GO:0016491)",,,['minor CHO metabolism.others'],LOC_Os10g02480,,31.4227529062088,4965,Black,16.9410347000453
77,Os07g0484600,Conserved hypothetical protein.,,,,['not assigned.unknown'],LOC_Os07g30120,,51.4331395231129,3297,Black,16.8358915084894
78,Os01g0113350,Hypothetical conserved gene.,"Biological Process: protein phosphorylation (GO:0006468), Molecular Function: protein kinase activity (GO:0004672), Molecular Function: protein serine/threonine kinase activity (GO:0004674), Molecular Function: ATP binding (GO:0005524), Molecular Function: transferase activity, transferring phosphorus-containing groups (GO:0016772)",MAK1,,['protein.postranslational modification.kinase.receptor like cytoplasmatic kinase VII'],LOC_Os01g02310,,47.0127675946625,3586,Black,16.6644257578277
79,Os08g0436600,Hypothetical conserved gene.,,,,['protein.degradation'],LOC_Os08g33900,,64.4074727058968,2652,Black,16.5251061897444
80,Os01g0126200,Multicopper oxidase,"Biological Process: oxidation-reduction process (GO:0055114), Molecular Function: copper ion binding (GO:0005507), Molecular Function: oxidoreductase activity (GO:0016491)",OsLPR2,,['not assigned.unknown'],LOC_Os01g03549,,29.0620835477531,5225,Black,16.4028188647783
81,Os06g0109200,"Protein of unknown function DUF6, transmembrane domain containing protein.",Cellular Component: membrane (GO:0016020),,,['development.unspecified'],LOC_Os06g01966,,80.9763167228831,2018,Black,16.3938390755964
82,Os05g0390000,Similar to predicted protein.,"Biological Process: lipid metabolic process (GO:0006629), Molecular Function: triglyceride lipase activity (GO:0004806)",,,['lipid metabolism.lipid degradation.lipases.triacylglycerol lipase'],LOC_Os05g32380,,34.9640241582253,4568,Black,16.2223943006686
83,Os08g0537001,Conserved hypothetical protein.,,OsSTA218,,['not assigned.unknown'],LOC_Os08g42480,,60.2805774513876,2847,Black,16.217975486944
84,Os12g0406000,"Conserved hypothetical protein., Hypothetical conserved gene.",,,,['not assigned.unknown'],LOC_Os12g21784,,33.9386301076975,4667,Black,15.9707366574407
85,Os01g0964133,Similar to Actin.,Molecular Function: ATP binding (GO:0005524),,,['cell.organisation'],LOC_Os01g73310,,31.8025506683978,4915,Black,15.8931242745896
86,Os01g0813800,"Similar to Beta-glucosidase 3., Similar to cDNA, clone: J065127F19, full insert sequence.","Biological Process: carbohydrate metabolic process (GO:0005975), Molecular Function: catalytic activity (GO:0003824), Molecular Function: hydrolase activity, hydrolyzing O-glycosyl compounds (GO:0004553), Molecular Function: cation binding (GO:0043169)",BGLU3,,"['misc.gluco-, galacto- and mannosidases']",LOC_Os01g59840,,30.1192529030726,5100,Black,15.6778859108307
87,Os02g0820900,"Similar to Ethylene receptor-like protein 2., Ethylene receptor, Ethylene response, Floral transition and starch accumulation","Biological Process: two-component signal transduction system (phosphorelay) (GO:0000160), Biological Process: regulation of transcription, DNA-dependent (GO:0006355), Biological Process: signal transduction (GO:0007165), Biological Process: ethylene mediated signaling pathway (GO:0009873), Biological Process: peptidyl-histidine phosphorylation (GO:0018106), Cellular Component: endoplasmic reticulum membrane (GO:0005789), Cellular Component: membrane (GO:0016020), Molecular Function: two-component sensor activity (GO:0000155), Molecular Function: two-component response regulator activity (GO:0000156), Molecular Function: protein histidine kinase activity (GO:0004673), Molecular Function: signal transducer activity (GO:0004871), Molecular Function: protein binding (GO:0005515), Molecular Function: ATP binding (GO:0005524), Biological Process: signal transduction (GO:0007165), Biological Process: peptidyl-histidine phosphorylation (GO:0018106), Cellular Component: membrane (GO:0016020), Molecular Function: two-component sensor activity (GO:0000155), Molecular Function: protein histidine kinase activity (GO:0004673), Molecular Function: signal transducer activity (GO:0004871), Molecular Function: protein binding (GO:0005515), Molecular Function: ATP binding (GO:0005524), Biological Process: two-component signal transduction system (phosphorelay) (GO:0000160), Biological Process: regulation of transcription, DNA-dependent (GO:0006355), Biological Process: signal transduction (GO:0007165), Biological Process: peptidyl-histidine phosphorylation (GO:0018106), Cellular Component: membrane (GO:0016020), Molecular Function: two-component sensor activity (GO:0000155), Molecular Function: two-component response regulator activity (GO:0000156), Molecular Function: protein histidine kinase activity (GO:0004673), Molecular Function: signal transducer activity (GO:0004871), Molecular Function: protein binding (GO:0005515), Molecular Function: ATP binding (GO:0005524)","ETR3, ETR3, OsETR3, OS-ETR3, OsETR3a, OsETR3b, OsPK2, PK2, OsERS4","MAPK signaling pathway - plant, Plant hormone signal transduction",,LOC_Os02g57530,,27.6997855626972,5396,Black,15.4446427552831
88,Os01g0250900,"HAD superfamily (subfamily IG) hydrolase, 5'-Nucleotidase protein.",,,,['not assigned.unknown'],LOC_Os01g14810,,56.3004411671893,3035,Black,15.2622714811752
89,Os11g0592800,Similar to CDK5RAP1-like protein.,"Biological Process: tRNA modification (GO:0006400), Biological Process: RNA modification (GO:0009451), Biological Process: macromolecule modification (GO:0043412), Cellular Component: cellular_component (GO:0005575), Cellular Component: cytoplasm (GO:0005737), Molecular Function: catalytic activity (GO:0003824), Molecular Function: transferase activity (GO:0016740), Molecular Function: iron-sulfur cluster binding (GO:0051536), Molecular Function: 4 iron, 4 sulfur cluster binding (GO:0051539)",,,"['metal handling.binding, chelation and storage']",LOC_Os11g38030,,83.0784286968988,1932,Black,15.2333401072457
90,Os11g0696600,Heat shock protein Hsp70 domain containing protein.,Molecular Function: ATP binding (GO:0005524),,,['not assigned.unknown'],LOC_Os11g47370,,50.1676906670272,3377,Black,15.2315184137618
91,Os10g0185100,Conserved hypothetical protein.,,,,,None,,60.4306657320069,2838,Black,15.180411096152
92,Os03g0717700,"Histidine kinase, Cytokinin signaling, Similar to Histidine kinase.","Biological Process: two-component signal transduction system (phosphorelay) (GO:0000160), Biological Process: regulation of transcription, DNA-dependent (GO:0006355), Biological Process: signal transduction (GO:0007165), Biological Process: phosphorylation (GO:0016310), Biological Process: peptidyl-histidine phosphorylation (GO:0018106), Cellular Component: membrane (GO:0016020), Molecular Function: two-component sensor activity (GO:0000155), Molecular Function: two-component response regulator activity (GO:0000156), Molecular Function: protein histidine kinase activity (GO:0004673), Molecular Function: signal transducer activity (GO:0004871), Molecular Function: ATP binding (GO:0005524), Molecular Function: transferase activity, transferring phosphorus-containing groups (GO:0016772), Biological Process: two-component signal transduction system (phosphorelay) (GO:0000160), Biological Process: regulation of transcription, DNA-dependent (GO:0006355), Molecular Function: two-component response regulator activity (GO:0000156)","HK4, OHK4, HK, OsHK4, Crl1b, Ohk4",Plant hormone signal transduction,['hormone metabolism.cytokinin.signal transduction'],LOC_Os03g50860,,91.8117651127777,1656,Black,15.0972726287606
93,Os06g0477600,Non-protein coding transcript.,,,,,None,,30.8850780494697,5016,Black,15.0528548656459
94,Os05g0591500,Similar to Cysteine synthase.,,,,['not assigned.unknown'],LOC_Os05g51380,,30.2728138927865,5076,Black,14.9747819571079
95,Os04g0628900,Cyclin-P1-1.,"Biological Process: regulation of cyclin-dependent protein kinase activity (GO:0000079), Molecular Function: protein kinase binding (GO:0019901)",,,['cell.cycle'],LOC_Os04g53680,,97.4388694513047,1500,Black,14.7852533542148
96,Os10g0548700,"Receptor-like cytoplasmic kinase, Various stress responses,  Regulation of resistance to bacterial leaf streak (BLS), Hypothetical conserved gene.","Biological Process: protein phosphorylation (GO:0006468), Biological Process: protein ubiquitination (GO:0016567), Molecular Function: protein kinase activity (GO:0004672), Molecular Function: ubiquitin-protein transferase activity (GO:0004842), Molecular Function: ATP binding (GO:0005524), Biological Process: protein phosphorylation (GO:0006468), Biological Process: protein ubiquitination (GO:0016567), Cellular Component: ubiquitin ligase complex (GO:0000151), Molecular Function: protein kinase activity (GO:0004672), Molecular Function: protein serine/threonine kinase activity (GO:0004674), Molecular Function: ubiquitin-protein ligase activity (GO:0004842), Molecular Function: ATP binding (GO:0005524), Molecular Function: transferase activity, transferring phosphorus-containing groups (GO:0016772)","RLCK306, OsPUB54, OsRLCK306, NRRB",,"['protein.postranslational modification.kinase.receptor like cytoplasmatic kinase VII', 'signalling.receptor kinases.misc']",LOC_Os10g40100,,30.5146809551442,5053,Black,14.7625581788631
97,Os08g0178700,Similar to Calmodulin-binding diacylglycerol kinase.,"Biological Process: activation of protein kinase C activity by G-protein coupled receptor protein signaling pathway (GO:0007205), Molecular Function: diacylglycerol kinase activity (GO:0004143)",,"Glycerolipid metabolism, Glycerophospholipid metabolism, Metabolic pathways, Biosynthesis of secondary metabolites, Phosphatidylinositol signaling system",['lipid metabolism.Phospholipid synthesis.diacylglycerol kinase'],LOC_Os08g08110,,49.2850640536989,3438,Black,14.7388581969869
98,Os07g0102400,Protein of unknown function DUF1084 family protein.,,,,['stress.biotic'],LOC_Os07g01250,,35.428700187214,4530,Black,14.6803504236792
99,Os11g0425800,Similar to 60S ribosomal protein L13a.,"Biological Process: translation (GO:0006412), Cellular Component: ribosome (GO:0005840), Molecular Function: structural constituent of ribosome (GO:0003735)",,,['not assigned.unknown'],LOC_Os11g23880,,33.2918123054972,4736,Black,14.5801735954934
