id,Label,TF,KEGG,Symbol,kTotal,Rank,WGCNA_Modules, IntraModular Connectivity,Description,GO,MapMan,MSU_LOC
80,Os10g0542400,,,,19.0505111879156,3618,Magenta,12.524665603626,Expansin/Lol pI family protein.,Cellular Component: extracellular region (GO:0005576),['cell wall.modification'],LOC_Os10g39640
81,Os09g0400600,,,,24.9384393420407,2614,Magenta,12.5223091156285,Hypothetical protein.,,['not assigned.unknown'],LOC_Os09g23595
82,Os01g0166100,,,,18.6162176520953,3697,Magenta,12.4715973947251,Similar to Ca(2+)-dependent nuclease.,"Molecular Function: nucleic acid binding (GO:0003676), Molecular Function: nuclease activity (GO:0004518), Molecular Function: hydrolase activity, acting on ester bonds (GO:0016788)",['DNA.unspecified'],LOC_Os01g07200
83,Os06g0239200,,,,38.7543825276715,1306,Magenta,12.396006982089,Conserved hypothetical protein.,,['not assigned.unknown'],LOC_Os06g13190
84,Os03g0269900,,,,19.1130980392933,3603,Magenta,12.3946370735641,Protein of unknown function DUF604 family protein.,,['not assigned.unknown'],LOC_Os03g16334
85,Os02g0740500,,,,34.9189918316684,1586,Magenta,12.3691186767934,Conserved hypothetical protein.,,['not assigned.unknown'],LOC_Os02g50700
86,Os01g0948600,,,,35.0025551555968,1576,Magenta,12.2911589239615,Conserved hypothetical protein.,,['not assigned.unknown'],LOC_Os01g72009
87,Os05g0134200,,,OsPP2C47,26.6528134773808,2373,Magenta,12.2903596029624,Similar to Protein phosphatase-2C.,"Biological Process: protein dephosphorylation (GO:0006470), Cellular Component: protein serine/threonine phosphatase complex (GO:0008287), Molecular Function: catalytic activity (GO:0003824), Molecular Function: protein serine/threonine phosphatase activity (GO:0004722)",['protein.postranslational modification'],LOC_Os05g04360
88,Os03g0610650,,,OsSRP-LRS|OsSPN|OrysaZxa,30.4840748097552,1943,Magenta,12.2875872252297,"Similar to cDNA clone:002-125-A07, full insert sequence.",Molecular Function: serine-type endopeptidase inhibitor activity (GO:0004867),,LOC_Os03g41419
89,Os10g0521000,,"Starch and sucrose metabolism, Metabolic pathways",OsTRE1,33.3542844324658,1685,Magenta,12.1623753134689,Similar to TRE1 protein (Fragment).,"Biological Process: trehalose metabolic process (GO:0005991), Molecular Function: catalytic activity (GO:0003824), Molecular Function: alpha, alpha-trehalase activity (GO:0004555)",['minor CHO metabolism.trehalose.trehalase'],LOC_Os10g37660
90,Os01g0813400,,Endocytosis,OsARFA1a,26.2921849803526,2428,Magenta,12.1592010739131,Similar to ADP-ribosylation factor 1.,"Biological Process: intracellular protein transport (GO:0006886), Biological Process: small GTPase mediated signal transduction (GO:0007264), Biological Process: protein transport (GO:0015031), Cellular Component: intracellular (GO:0005622), Molecular Function: GTP binding (GO:0005525)",['protein.targeting.secretory pathway.unspecified'],LOC_Os01g59790
91,Os01g0867300,bZIP,Plant hormone signal transduction,"BZIP12, OsbZIP12, OsABF1",23.6153549806949,2800,Magenta,12.1135358983442,"bZIP transcription factor, Abiotic stress response, ABA signaling, Suppressor of floral transition upon drought stress","Biological Process: regulation of transcription, DNA-templated (GO:0006355), Molecular Function: transcription factor activity, sequence-specific DNA binding (GO:0003700), Molecular Function: sequence-specific DNA binding (GO:0043565)",['RNA.regulation of transcription.bZIP transcription factor family'],LOC_Os01g64730
92,Os05g0594100,,,,25.3955824892571,2545,Magenta,12.0952768200996,Similar to GDA2 protein.,,"['stress.abiotic.touch/wounding', 'cell.cell death']",LOC_Os05g51590
93,Os02g0173200,,,OsVQ5,38.4499883229138,1332,Magenta,11.8602754508452,VQ domain containing protein.,,['not assigned.unknown'],LOC_Os02g07690
94,Os01g0935600,,,,28.0123927209267,2212,Magenta,11.7434656244961,"Immunoglobulin/major histocompatibility complex, conserved site domain containing protein., Similar to Cold-induced thioredoxin domain-containing protein., Similar to predicted protein.","Molecular Function: catalytic activity (GO:0003824),",['not assigned.unknown'],LOC_Os01g70950
95,Os03g0351300,,,,16.6550995053802,4172,Magenta,11.6077486430113,Similar to beta-amylase.,"Biological Process: polysaccharide catabolic process (GO:0000272), Biological Process: carbohydrate metabolic process (GO:0005975), Molecular Function: catalytic activity (GO:0003824), Molecular Function: beta-amylase activity (GO:0016161), Molecular Function: cation binding (GO:0043169)",['major CHO metabolism.degradation.starch.starch cleavage.beta amylase'],LOC_Os03g22790
96,Os03g0341300,,,SWEET16,19.5870427243295,3510,Magenta,11.5574613431079,Similar to Cytochrome c oxidoreductase.,Cellular Component: integral to membrane (GO:0016021),['development.unspecified'],LOC_Os03g22200
97,Os05g0206100,,,OsCEP11,17.1034228070684,4042,Magenta,11.5339204567642,Conserved hypothetical protein.,,['not assigned.unknown'],LOC_Os05g11620
98,Os08g0524200,,,,20.8133543484143,3253,Magenta,11.5135409477913,Uncharacterised conserved protein UCP037471 domain containing protein.,Cellular Component: integral to membrane (GO:0016021),['hormone metabolism.auxin.induced-regulated-responsive-activated'],LOC_Os08g41280
99,Os06g0214300,,,,17.7476290371181,3883,Magenta,11.4816365287932,Alpha/beta hydrolase fold-3 domain containing protein.,"Biological Process: metabolic process (GO:0008152), Molecular Function: hydrolase activity (GO:0016787)",['Biodegradation of Xenobiotics'],LOC_Os06g11090
