id,Label,TF,KEGG,Symbol,kTotal,Rank,WGCNA_Modules, IntraModular Connectivity,Description,GO,MapMan,MSU_LOC
76,Os10g0325400,,,,13.5446715284962,5052,Tan,4.89933043857542,"Remorin, C-terminal domain containing protein.",,['not assigned.unknown'],LOC_Os10g17790
77,Os05g0580000,,"Starch and sucrose metabolism, Amino sugar and nucleotide sugar metabolism, Metabolic pathways, Biosynthesis of secondary metabolites","OsAGPL1, OsAPL3",8.81592375871072,6800,Tan,4.87648596398318,Similar to ADP-glucose pyrophosphorylase (EC 2.7.7.27) (Fragment).,"Biological Process: glycogen biosynthetic process (GO:0005978), Biological Process: biosynthetic process (GO:0009058), Molecular Function: glucose-1-phosphate adenylyltransferase activity (GO:0008878), Molecular Function: transferase activity (GO:0016740), Molecular Function: nucleotidyltransferase activity (GO:0016779)",['major CHO metabolism.synthesis.starch.AGPase'],LOC_Os05g50380
78,Os04g0448300,,,,16.1714893071047,4310,Tan,4.86137755846476,Peptidase A1 domain containing protein.,"Biological Process: proteolysis (GO:0006508), Molecular Function: aspartic-type endopeptidase activity (GO:0004190)","['RNA.regulation of transcription.unclassified', 'protein.degradation.aspartate protease']",LOC_Os04g37550
79,Os12g0268000,,,"SL, OsSL, CYP71P1, LLM1, CYP71A1, T5H",9.73917745510942,6395,Tan,4.82813217246666,Similar to Cytochrome P450 71A1 (EC 1.14.-.-) (CYPLXXIA1) (ARP-2).,"Biological Process: oxidation-reduction process (GO:0055114), Molecular Function: iron ion binding (GO:0005506), Molecular Function: electron carrier activity (GO:0009055), Molecular Function: oxidoreductase activity, acting on paired donors, with incorporation or reduction of molecular oxygen (GO:0016705), Molecular Function: heme binding (GO:0020037)",['misc.cytochrome P450'],LOC_Os12g16720
80,Os04g0521900,,,,6.32366894318914,8082,Tan,4.78799313388489,Similar to Vegetative cell wall protein gp1.,,,None
81,Os11g0515000,,,,6.08219498743092,8227,Tan,4.78719818745916,Armadillo-like helical domain containing protein.,Molecular Function: binding (GO:0005488),['not assigned.unknown'],LOC_Os11g31590
82,Os03g0808300,,,,7.02587120871303,7687,Tan,4.65933723554308,"Remorin, C-terminal region domain containing protein.",,['RNA.regulation of transcription.putative transcription regulator'],LOC_Os03g59360
83,Os01g0976300,,,,20.7089422771055,3274,Tan,4.5452196518405,Heavy metal transport/detoxification protein domain containing protein.,"Biological Process: metal ion transport (GO:0030001), Molecular Function: metal ion binding (GO:0046872)","['metal handling.binding, chelation and storage']",LOC_Os01g74490
84,Os03g0148000,,,,9.83530185947177,6369,Tan,4.53112830138996,Protein of unknown function DUF677 family protein.,,['RNA.processing'],LOC_Os03g05440
85,Os06g0539500,,,OsLTP1.6,6.85090036496354,7786,Tan,4.52264908414381,Similar to Non-specific lipid-transfer protein.,"Biological Process: lipid transport (GO:0006869), Molecular Function: lipid binding (GO:0008289)",['not assigned.unknown'],LOC_Os06g34840
86,Os08g0465800,,"Alanine, aspartate and glutamate metabolism, beta-Alanine metabolism, Taurine and hypotaurine metabolism, Butanoate metabolism, Metabolic pathways, Biosynthesis of secondary metabolites",RicGAD,12.9823799812142,5254,Tan,4.50648639833867,Similar to Glutamate decarboxylase.,"Biological Process: glutamate metabolic process (GO:0006536), Biological Process: carboxylic acid metabolic process (GO:0019752), Molecular Function: catalytic activity (GO:0003824), Molecular Function: glutamate decarboxylase activity (GO:0004351), Molecular Function: carboxy-lyase activity (GO:0016831), Molecular Function: pyridoxal phosphate binding (GO:0030170)",['amino acid metabolism.synthesis.central amino acid metabolism.GABA.Glutamate decarboxylase'],LOC_Os08g36320
87,Os07g0686300,,,,7.14907774688114,7620,Tan,4.50052101904733,"Zinc finger, RING/FYVE/PHD-type domain containing protein.","Molecular Function: protein binding (GO:0005515), Molecular Function: zinc ion binding (GO:0008270)",['not assigned.unknown'],LOC_Os07g48680
88,Os04g0523812,,,,13.3680944705958,5118,Tan,4.41353698461972,Conserved hypothetical protein.,,,None
89,Os02g0520750,,,,10.1264788446253,6269,Tan,4.33905153120292,Similar to H0209H04.3 protein.,Cellular Component: membrane (GO:0016020),['misc.UDP glucosyl and glucoronyl transferases'],LOC_Os02g32110
90,Os06g0549600,,,,13.6686934812908,5012,Tan,4.18380145336481,"FAD-linked oxidase, FAD-binding, subdomain 2 domain containing protein.","Biological Process: oxidation-reduction process (GO:0055114), Molecular Function: catalytic activity (GO:0003824), Molecular Function: UDP-N-acetylmuramate dehydrogenase activity (GO:0008762), Molecular Function: oxidoreductase activity (GO:0016491), Molecular Function: oxidoreductase activity, acting on CH-OH group of donors (GO:0016614), Molecular Function: flavin adenine dinucleotide binding (GO:0050660)","['misc.nitrilases, *nitrile lyases, berberine bridge enzymes, reticuline oxidases, troponine reductases']",LOC_Os06g35650
91,Os03g0762300,,"Phenylpropanoid biosynthesis, Metabolic pathways, Biosynthesis of secondary metabolites",,6.55233111178961,7951,Tan,4.14758213927288,"Similar to Peroxidase 51 precursor (EC 1.11.1.7) (Atperox P51) (ATP37)., Similar to peroxidase 51.","Biological Process: response to oxidative stress (GO:0006979), Biological Process: oxidation-reduction process (GO:0055114), Molecular Function: peroxidase activity (GO:0004601), Molecular Function: heme binding (GO:0020037)",['misc.peroxidases'],LOC_Os03g55410
92,Os02g0258800,,,,7.30863149933189,7531,Tan,4.13329549141507,Conserved hypothetical protein.,,['not assigned.unknown'],LOC_Os02g15860
93,Os11g0131100,,,OsVQ37,12.0427305950397,5555,Tan,4.08369301319287,VQ domain containing protein.,,['not assigned.unknown'],LOC_Os11g03660
94,Os04g0581800,,,,10.2542001962671,6229,Tan,3.98863634441568,Heavy metal transport/detoxification protein domain containing protein.,"Biological Process: metal ion transport (GO:0030001), Molecular Function: metal ion binding (GO:0046872)","['metal handling.binding, chelation and storage']",LOC_Os04g49260
95,Os03g0146000,,,,8.57301743090927,6909,Tan,3.9883216108086,Similar to RAB1X.,"Biological Process: GTP catabolic process (GO:0006184), Biological Process: intracellular protein transport (GO:0006886), Biological Process: nucleocytoplasmic transport (GO:0006913), Biological Process: signal transduction (GO:0007165), Biological Process: small GTPase mediated signal transduction (GO:0007264), Biological Process: protein transport (GO:0015031), Cellular Component: intracellular (GO:0005622), Cellular Component: membrane (GO:0016020), Molecular Function: GTPase activity (GO:0003924), Molecular Function: GTP binding (GO:0005525)",['signalling.G-proteins'],LOC_Os03g05280
96,Os03g0760800,,,"GASR1, OsGASR1",9.22390367828476,6612,Tan,3.95782779904493,"A member of the GAST (gibberellin (GA)-Stimulated Transcript) family, Control of seedling growth and &alpha;-amylase expression, Cell proliferation in meristems and panicles development",,['hormone metabolism.gibberelin.induced-regulated-responsive-activated'],LOC_Os03g55290
97,Os02g0189200,,,GELP31,4.92131148394709,8974,Tan,3.94919053990024,"Lipase, GDSL domain containing protein.","Biological Process: lipid metabolic process (GO:0006629), Molecular Function: hydrolase activity, acting on ester bonds (GO:0016788)",['misc.GDSL-motif lipase'],LOC_Os02g09610
98,Os05g0280500,,"Glycerolipid metabolism, Glycerophospholipid metabolism, Metabolic pathways, Biosynthesis of secondary metabolites",,4.05088016160164,9626,Tan,3.9106295605864,Phospholipid/glycerol acyltransferase domain containing protein.,"Biological Process: metabolic process (GO:0008152), Molecular Function: transferase activity, transferring acyl groups (GO:0016746)",['lipid metabolism.Phospholipid synthesis'],LOC_Os05g20100
99,Os03g0370400,,,,4.550969502212,9230,Tan,3.90729465606074,Protein of unknown function DUF679 family protein.,,['not assigned.unknown'],LOC_Os03g25440
